,created_utc,body
86,2017-01-01 14:55:04,"### **[American Beauty (1999)](http://www.imdb.com/Title?American+Beauty+%281999%29)**

Drama [[USA:R](https://en.wikipedia.org/wiki/Motion_Picture_Association_of_America_film_rating_system#Ratings), 2 h 2 min]  
Kevin Spacey, Annette Bening, Thora Birch, Wes Bentley  
Director: Sam Mendes

**IMDb rating:** [](#movieguide_stars)**&amp;#9733;&amp;#9733;&amp;#9733;&amp;#9733;&amp;#9733;&amp;#9733;&amp;#9733;&amp;#9733;&amp;#9734;&amp;#9734;** **8.4**/10 (817,037 votes)

&gt; Lester Burnham is a loser suburbanite rebelling against his dead-end job, bitch-on-wheels wife, unloving daughter, and imminent middle-age. His subsequent actions unfold into a darkly comic drama laced with a stellar supporting cast and enough roses to fill a nursery.
(*IMDb*)

**Critical reception:**
&gt; Writing in Variety, Todd McCarthy said the cast ensemble ""could not be better""; he praised Spacey's ""handling of innuendo, subtle sarcasm, and blunt talk"" and the way he imbued Lester with ""genuine feeling"". Janet Maslin in The New York Times said Spacey was at his ""wittiest and most agile"" to date, and Roger Ebert of the Chicago Sun-Times singled Spacey out for successfully portraying a man who ""does reckless and foolish things \[but who\] doesn't deceive himself"". Kevin Jackson of Sight &amp; Sound said Spacey impressed in ways distinct from his previous performances, the most satisfying aspect being his portrayal of ""both sap and hero"". Writing in Film Quarterly, Gary Hentzi praised the actors, but said that characters such as Carolyn and Col. Fitts were stereotypes. Hentzi accused Mendes and Ball of identifying too readily with Jane and Ricky, saying the latter was their ""fantasy figure""—a teenaged boy who's an absurdly wealthy artist able to ""finance \[his\] own projects"". Hentzi said Angela was the most believable teenager, in particular with her ""painfully familiar"" attempts to ""live up to an unworthy image of herself"". Maslin agreed that some characters were unoriginal, but said their detailed characterizations made them memorable. Kenneth Turan of the Los Angeles Times said the actors coped ""faultlessly"" with what were difficult roles; he called Spacey's performance ""the energy that drives the film"", saying the actor commanded audience involvement despite Lester not always being sympathetic. ""Against considerable odds, we do like \[these characters\],"" Turan concluded.
(*Wikipedia*)

More info at [IMDb](http://www.imdb.com/Title?American+Beauty+%281999%29), [Wikipedia](https://en.wikipedia.org/w/index.php?title=American%20Beauty%20%281999%20film%29), [Rotten Tomatoes](https://www.rottentomatoes.com/m/american_beauty/), [Metacritic](http://www.metacritic.com/movie/american-beauty), [Netflix](http://movies.netflix.com/WiMovie/60000407), [Wikidata](https://www.wikidata.org/wiki/Q25139).  
*I am a bot.* [Send me feedback](https://www.reddit.com/message/compose?to=%2Fr%2FMovieGuide&amp;subject=Re%3A%20http%3A%2F%2Fredd.it%2F5lgsoe ""Confidence: 1.12""). [Data sources and other information](/r/MovieGuide/w/about).
"
87,2017-01-01 22:49:39,They really did bro. The difference is that we can tel the difference between a speech about gender and diversity in finance And singlehandedly crashing the world economy and know they're not the same thing. 
88,2017-01-01 13:54:03,"And a competent finance minister, rbi chief, advisors, home minister etc etc..
Or maybe if there was one guy in the entire government who had a rats ass of a clue as to what will happen when you begger a country to feed the banks...

P.s. You'll notice I implied glorious leaders himself is incompetent."
89,2017-01-01 00:29:53,"Sure, I don't like to do AMA's because there is a strong anti-wall street sentiment there, and there have been other AMA's, so most of what I have to say is repetition. Firstly, it depends on GPA, that of course determines what college you get into. In High School I worked my ass off, I ended high school with a 4.3 GPA, started a finance club, acted, fenced, and I am (in name) hispanic. What I mean by that is that I am 25% Mexican, just Mexican enough to put hispanic on college applications, but also I look white. This provides an advantage, because almost all the interviewers at hedge funds are white as well. They aren't openly racist or anything, its just an almost universal trend that people tend to identify more with the same race. However I'm going off topic, I undergraded at William and Mary, for a few reasons.

1. They have a great business school.

2. I am from VA, so I got instate tuition.

3. They are a great school overall.

That being said, I got into great schools, princeton, harvard, MIT, but I wanted my undergrad for myself

At William and Mary I double majored in Computer Science and Economics. 

However I've also received my MBA. From Columbia. I decided on columbia for a few reasons.

1. Obviously, great school, ranked 4th in the US.

2. It let me be in New York, and I wanted to get a feel for the city, as hedge funds are quite prominent in NYC. 

I interviewed for an intern position after college with Bridgewater associates, which is ironically not based in NYC, but in Westport Connecticut. To answer one question, the college didn't really, but they were impressed that I had both economics and business knowledge as well as computer experience. What they really liked is that I had an MBA from an Ivy. They love that, because many of the chief officers have those. Also, a tip I learned. Dress for it, and talk for it. I've heard stories of people who tried to be the ""hipster finance guru"", and show up in ripped jeans and a t shirt. Don't do that. Try and mimic the guy your interviewing, act like you would if you were his friend. To answer the question about the overworked wall street grunt, yes and no. Like I said, the senior employees don't treat you like scum, and you feel like you are contributing, you aren't getting them coffee. However, while it isn't explicitly stated, you are expected to come early and stay late, though how hard depends on whether you really want to climb. Make it a goal to befriend your coworkers and bosses, hedgefunds are fairly small enterprises in terms of number of employees, relatively anyway. So recommendations from experienced employees are worth a lot. The money is quite good. I've been working there for 2.5 years, and am well on my way to being a portfolio manager, which would provide quite the pay raise. I'm also paying back my parents for all my schooling expenses that my 529 plan couldn't cover. 

So to answer your questions: I attended William and Mary for undergrad and Columbia for my MBA. My grad school impressed the interviewer. In many ways the stereotype is right, but if you want to work at a hedge fund, you are probably hardworking anyway, so its not horrible.

If you have more questions feel free to ask or PM me. 

"
90,2017-01-01 10:45:26,"I think this sounds best.

Don't suppose you've read Pratchett's Small Gods have you? Very interesting ideas in terms of gods, how they subsist and come about and their relationships with their believers in that book.

At any rate, if you're having these gods be like standard D&amp;D gods (i.e. not opposed to actually talking to their worshippers) i'd say have them act a just as much eccentricity as their origins would suggest.

Sort of like Magic Hermit Crabs, people started believing in these ideas, and belief has power, so something came or grew to fill it. Maybe some of them were just minor spirits who found a niche, maybe some of them were born from the belief itself, and maybe some are surviving gods from other faiths - pre-apocalypse or post, since a thousands of years is a long time - who managed to hang on for long enough to find a new wellspring in faith.

Now you have these god things inhabiting the shell of their belief, but with identities torn and confused between whatever their true origins might be, whatever they know of their shells origins of the old pre-apocalypse world, and whatever humans might actually believe of them.

The people of the wasteland might indeed worship the twin gods of Heckler &amp; Kosch as the Lawful Evil gods of War &amp; Finance - who are joined together like siamese twins as some no doubt clever religious metaphor. They preach reliable businesslike professionalism in war (think Hitman, Assassins Creed, Lord of War; that sort of consummate professional killer who scorns unnecessary killing as pointless but has no issues with mass murder if it *does* have a point) and are also worshipped by those who believe in the honesty of contracts and the punishment of oath breakers.

 The gods themselves however might in their past lives have been a some raving barbarian god of war who's tribe was wiped out and a peaceful &amp; beneveolent god of Law, Merchants and Cities. Both now squeezed into their new guises of armani suits, sunglasses and machine pistols - and trapped in a odd couple relationship with one another to survive on the new faith.

They know the values of what they used to be, they have an idea of what Heckler &amp; Kosch stood for, and they know what their worshippers think they are. And they are very confused.

You could have a lot of fun with this if you wanted to. I imagine some very exacerbated priests."
91,2017-01-01 22:42:50,My best friend was really drunk and went to be early so no one was around to give his finance her midnight kiss. So I did and then it got heated. To be fair I had also made out with him before. 
92,2017-01-01 04:51:19,"Despite his talent as a writer, Tony has been insanely ~~unsuccessful~~ unprofitable as a solo artist, and like you said, he has almost no stage presence, I can't imagine any record company investing in a solo tour for him. He is certainly rich enough, he could easily finance a tour himself and play a few smaller venues. But after selling out a stadium tour as Genesis I'm not so sure his ego could take such a bruising."
93,2017-01-01 22:04:04,"
I like it here.  There are some downsides, but I couldn't picture myself living anywhere else for a good while.

I'm incredibly picky but have access to almost anything I could want in New York.  Depending on your interests/lifestyle, that could fuel some very materialistic habits or be a great resource.  Generally though, things here are better quality if you can afford them.

Big upside for me is that I like walking around and watching people.  The parks are beautiful.  The vegan food is awesome.  Life looks and feels like a movie a lot of the time.  I can wear all black and not smile all day and no one will call me out for it.  I can embarrass myself and remain anonymous.  People stop caring about privacy and you will witness their intimate moments.  A girl will squat piss in front of you and not care.  A man will be playing a saxophone.

There are a lot of talented people here, which is inspiring but can also be crushing knowing you will never weigh up, knowing you will never be as efficient, letting yourself waste your own time.  It will discourage you or make you try harder.  You will raise your standards and develop your taste.

There are also a lot of social climbers and young professional types who don't understand subcultures but move to Brooklyn and become ""creative.""  It bothers me.  Other downsides:  Filth, limited space, bad produce, everything being so expensive.  It can be hard to have ""think time.""

I do finance/accounting for a photo studio which is a pretty interesting environment.  Another huge perk for me in New York is the media production industries.  Basically I can work in finance (which I can do decently well) but still be in a flexible, creative environment with people I'm mentally in line with (a lot of N types).

More downsides:  I feel like my life is my job.  I'm incredibly isolated and lonely.  I have friends here, but not friends that I'm deeply connected with.  Everyone is busy and has their own thing going on, and I'm not one to reach out and make plans.  I'm not sure if this is adulthood or a phase, but damn, it's rough.

Also nice:  It's a breeze to leave the country, if you do need a break sometime."
94,2017-01-01 22:27:04,"What?

&gt; but ultimately dumped his finance Andy Dorfman for banging some other dude on the show.

I thought you meant ""fiance.""

If so, they were in a relationship"
95,2017-01-01 04:36:39,"You hate someone for being entertaining and for bringing a great perspective to Magic from an investment standpoint that transcends Magic investments? First off hate is a terrible word to use.  Second,  all Rudy talks about is real life applicable logic when it comes to personal finance and doing it responsibly.. If you actually sit down and watch all of his videos you can gain alot of valuable insight into just how he made all his money and how you could potentially do the same (I am talking about not even investing in Magic and purely Economics and you can tell that Rudy loves to teach these important lessons).  Ease off of the guy i find him incredibly refreshing.  "
96,2017-01-01 21:11:09,Why does this question keep coming up? The rich who own the corporations selling you stuff want the poor and middle class to spend their entire paycheck and go into debt buying the stuff sold by their corporations. Saving is equivalent to competing with the rich for ownership of the corporations. Any attempts to introduce personal finance courses will be met by extremely well funded opposition.
97,2017-01-01 23:22:33,"Yeah I know. I actually work in finance haha.  
Im just super unorganized when it comes to my own stuff."
98,2017-01-01 23:32:34,"The short answer about voiding your warranty is no.

The long answer is the expression itself ""void your warranty"" is inaccurate. The correct interpretation is the manufacturer can deny a warranty claim if it is proven to be the direct result of an unapproved repair.  So in this example:  If Costco broke a wheel stud while changing your tire it would not be covered under your factory warranty, but nothing else regarding your warranty changes. If your power window motor stops working next week it is in no way related to the tire change and would be honored.    

Also, you are better off buying your tires yourself for many reasons.  1. The dealership tires I've seen offered are shit (winter claw or some other no name brand). X-ice and blizzacks from Costco are top rated tires year after year by the APA. 2. You also don't want to finance a consumable that will probably wear out before you've paid for them (getting 3 years on a set of tires but you're paying for them for 5 years).    Do yourself a favor though and buy rims.  "
