,created_utc,body
0,2017-01-01 20:15:43,Hard work indeed. Why there isn't a personal finance course in high school is mind boggling to me. 
1,2017-01-01 15:07:44,"&gt; If the accountant *needs to do some emergency finance work at 4 AM on New Year's Day*, he's fucked something up and it's going to come down on him now."
2,2017-01-01 02:59:36,"/r/fatpeoplestories. None of those happened, the writing is massively over the top and I don't want to read a ten part saga about how Janet from Finance ate a Big Mac instead of a salad for lunch."
3,2017-01-01 06:55:02,"Yeah the ""laying in"" period in many cultures sounds far superior to the postpartum rituals we have in the US.

The US is a trainwreck when it comes to this. The US also has higher maternal mortality rates than Iran and Saudi Arabia.

https://www.rt.com/usa/362297-maternal-mortality-rates-america/

But yeah, the anti-feminists must be right, women in the US have it better than women anywhere else in the world /s

Update: check out these articles I found http://qz.com/500003/the-painful-hidden-hell-that-awaits-mothers-who-return-to-work-two-weeks-after-giving-birth/ http://www.kidspot.com.au/birth/trimesters/pregnancy-work-and-finance/could-you-return-to-work-2-weeks-after-giving-birth-these-mums-had-to"
4,2017-01-01 20:25:09,"There is, I'm in high school right now and I made it a point to take every single one of them. But I will say that they are not advertised as personal finance

Edit: another class that I think should be more accessable is culinary arts. It is the single most useful skill one can have and it will save broke college students money"
5,2017-01-01 08:50:42,"On the eve of New Year's Eve (New Year's Eve eve?), I had a 3 am extensive conversation about exactly this with a friend as we tried to sober up. We're very exciting people when we party.

He's not a redditor, so we were discussing the general terms - not the subs specifically. He has no horse in the race of what sub is the superior sub. Full disclaimer: I do. I love /r/financialindependence, I dip my toes in /r/personalfinance. But I can only take so much of it, since I'm really here to learn about and share the more narrow, focused ideas of this sub.

Which leads me to our agreed conclusion: financial independence is a subset of personal finance, not a separate topic. PF is a more general field of study, with FI being one possible school of thought within it. Like ""economics"" vs. ""Austrian economics.""

Then to your question: FI tactics - as a ""get rich slowly"" scheme within the broad umbrella of PF - are extremely likely to focus on low risk investment, maximized at the expense of general consumer spending and Keeping Up With The Joneses. PF by no means has to involve the same low risk investments (even though the same are often recommended) and in no way implies a reduction in consumer spending. A completely appropriate PF question would be ""How big a pile of bullshit can I afford? Neighbor just got a huge steaming pile, and I enviously smell it all the time. I want my own but I'm not sure how much bullshit I can finance on X salary with Y mortgage payment and Z savings goal."" The corollary in FI is more like ""Neighbor just bought a big pile of bullshit. Why would you do that when you could have sweet, sweet low-cost index funds with Vanguard and buy cow pies for life?"""
6,2017-01-01 16:00:57,"His filthy rich parents sent him to school where he got a BA in finance and history (read: didn't know what the hell to do). They got him a finance job in NY where he lasted less than a year, and then he left that and the family created a position for him with the 49ers. Jim Harbaugh once kicked him out of the 49ers locker room saying it was, ""for men only.""

Jed York is a 37-year-old trust fund kid. "
7,2017-01-01 01:55:46,Make it happen!!! Reddit will finance the first date.
8,2017-01-01 09:03:40,"Pankaja Munde-Palve, daughter of the late Gopinath Munde, has won a successive Assembly election from Parli. She defeated her first cousin, Nationalist Congress Party candidate Dhananjay Munde. Her sister, Preetam Munde, won the Lok Sabha by-poll from her father’s constituency of Beed.

Pankaja’s and Preetam’s first cousin, Poonam Mahajan, daughter of Pramod Mahajan, is a Lok Sabha MP from Mumbai North-Central.



Rajasthan Chief Minister Vasundhara Raje with son Dushyant Singh.
Vasundhara Raje is chief minister of Rajasthan. Her son Dushyant Singh is a Lok Sabha MP.

Raje’s sister, Yashodhara Raje Scindia, is the industries minister in Madhya Pradesh. (Vasundhara Raje’s nephew, Jyotiraditya Scindia, is a Congress MP)



 
Chhattisgarh Chief Minister Raman Singh’s son, Abhishek, is Lok Sabha MP from Rajnandgaon.



 
Former Himachal Pradesh chief minister Prem Kumar Dhumal’s son, Anurag Thakur, is Lok Sabha member from Hamirpur.



 
Maneka Gandhi is a member from Pilbhit in Uttar Pradesh and the Women and Child Development minister in the Modi government. Her son Varun Gandhi is an MP from Sultanpur, UP.

Former UP CM and Rajasthan Governor Kalyan Singh’s son, Rajveer, is an MP from Etah.

Former Delhi CM (late) Sahib Singh Verma’s son, Parvesh, is an MP from Delhi. 



 
External Affairs Minister Sushma Swaraj’s sister Vandana Sharma lost the Assembly poll from Safidon in Haryana.

Former Karnataka CM and current BJP vice-president B S Yeddyurappa’s son Raghavendra is an MLA from Shikaripura.

Home Minister Rajnath Singh’s son Pankaj is a general secretary of BJP’s UP unit.



 
Former finance minister Yashwant Sinha’s son Jayant is an MP from Hazaribagh.

Senior leader Lalji Tandon’s son Ashutosh was elected party MLA from Lucknow East in the recent by-polls to UP Assembly.



 
Minister for Power, Coal and New and Renewable energy Piyush Goyal is the son of former minister and party treasurer late Ved Prakash Goyal.

Madhya Pradesh Minister of State for Culture Surendra Patwa is the nephew of former state CM Sunderlal Patwa.

Ajay Malhotra, son of senior leader V L Malhotra, unsuccessfully contested the Delhi Assembly elections of 2013, as did Rajiv Babbar, son of Delhi BJP leader O P Babbar.



 
Lalitha Kumaramangalam, National Commission for Women chairperson, is a BJP spokesperson. She is the daughter of socialist leader Mohan Kumaramangalam and sister of former BJP minister P R Kumaramangalam. 

http://www.rediff.com/news/report/like-congress-bjp-too-guilty-of-dynastic-politics/20141021.htm"
9,2017-01-01 20:21:32,"&gt;There's literally zero evidence he was connected to Clinton in any way. 

[Oh Really?](http://abcnews.go.com/International/fbi-arrests-chinese-millionaire-tied-clinton-scandal/story?id=33990683) And why would you say that? [Correcting the Record?](http://cdn.thedailybeast.com/content/dailybeast/articles/2015/10/07/chinese-billionaire-arrested-in-u-n-bribery-case-has-clinton-links/jcr:content/body/inlineimage.img.800.jpg/48139905.cached.jpg)

The Chinese Billionaire, Ng Lap Seng was a donator to the Clinton Campaign and Foundation. He was arrested by the FBI as the alleged secret source of foreign money in a campaign finance scandal during the Clinton administration.

John Ashe was set to testify in the case 4 days after he was found dead with a barbell over his neck. 

"
10,2017-01-01 18:06:36,I used to be a network engineer for a finance based business... lol
11,2017-01-01 04:19:58,"They're mini diggers so closer £5k, but what I heard was that it wasn't so much the cost of getting them out as the difficulty of getting a permit for a large enough crane to lift them and closing a residential central London street for a significant part of a day to do it. In terms of the overall cost of the work a 5k digger is insignificant. Here are some articles. 

http://www.equipmentworld.com/buried-alive-why-london-contractors-buried-up-to-10-million-worth-of-perfectly-good-excavators-beneath-their-jobsites/

http://www.newstatesman.com/business/2014/06/bizarre-secret-london-s-buried-diggers

http://www.telegraph.co.uk/finance/property/news/10879282/Londons-trail-of-buried-diggers.html

Although the bbc and others have claimed it is an urban legend. 
https://www.google.co.uk/amp/www.bbc.co.uk/news/amp/35376020"
12,2017-01-01 18:09:31,"Either way, definitely head over to r/personal finance. If you're blowing through $8,000 to $11,000 a month, carrying debt and broke, you're making absolutely horrific financial choices. 

SO head over to PF, post your details of your income, debts and expenses, and let people there help you build a plan. They'll probably be very frank with you; consider that a good thing, it's time to get a kick in the butt about taking control of your finances.

The good news is that it's very easy to turn this around with basic budgeting and a plan. This is your money. You are in control of it. Even if child support does become part of your future, a healthy financial plan at your income level will allow you to compensate for that and still grow your net worth. "
13,2017-01-01 18:00:03,Also a savvy personal finance advisor apparently
14,2017-01-01 21:30:35,"Okay, I'll be the one to address this nonsense. 

&gt;There are going to be Trumpsters disguising themselves as liberals and socialists in order to create division among us.

There are people who supported Trump who are liberals and socialists. I am one of them. Feel free to act like I don't exist. I voted for Sanders in the primary. I phone banked. I donated. I voted for the lesser of two evils this November. I will not support a corrupt democratic establishment. 

&gt;If it's a rightwing site, downvote and repor

Anyone, and I mean literally *anyone* who tells you to blanket ignore a source has ulterior motives. Silencing the opposition only means you are afraid of what they have to say. People with differing political viewpoints overlap all the time. 

Take Trump's hatred of the TPP, and NAFTA, for instance. 

&gt;notify the mods and report the user and their comment.

So let me get this straight, if anyone has ever posted in the_donald, you should report them to the mods, and they are automatically a troll? 

How about me? I had the #1 post on all of Reddit for roughly 9 hours, discussing the DNCleaks and potential violations of campaign finance laws. I posted it to the_donald (edit: added [link](https://www.reddit.com/r/The_Donald/comments/4vbo4x/cross_post_from_rdncleaks_this_is_really_big_dnc/?st=ixfl5f47&amp;sh=20c31b54)). Let's hear the straw man of why I should be reported to mods. 

&gt;we all have a common enemy in Donald J Trump

A good portion of this sub's users supported Donald J Trump over Hillary Clinton. 

Our enemy is corrupt government. 


"
15,2017-01-01 12:03:01,"I watched The Big Short again last night and the end scene hit me.  There are thousands of people lining up for shitty jobs they won't get.  I relived the despair and hopelessness of applying for anything that would help pay  the bills.   Trump is being handed a robust economy where people have buying power again.  His protectionist policies and destructive finance ideas will put us back there once again.  And no, January 20th isn't the darkness before dawn.  The darkness will last much much longer. "
16,2017-01-01 17:29:28,"A lot of them are in SAG and are used to the industry being run a certain way. Animation voice actors get residuals and there's a lot of other work that goes into that, so why shouldn't VO for video games get them too? 

That's the way they see it and I kind of agree but I'm no lawyer or finance man so I can't ascertain what's 'right'"
17,2017-01-01 18:12:59,"Ah.......the feeling of ""other things must be better than this shit"". I dig you but find ways to try things out first before you make any decision. I switched my major 3 times from Math to Finance then finally CS. When I got 4.0 GPA in sophomore year, I also think I can do anything! No one is smarter than me! But yeah.....every coin has two sides. Learn the advantages and disadvantages first"
18,2017-01-01 20:26:53,"My state has a statewide personal finance course as a high school graduation requirement. You learn about student loans, car loans, budgets, credit, and everything you need to succeed as an adult. 

Since it's a high school class people blow it off and ignore it, and I'm sure Missouri isn't #1 in personal finance knowledge or anything. 

People vastly overestimate how much a personal finance high school class will help. "
19,2017-01-01 17:41:38,"Tried that with my last support gig some years ago. A router from the bank that handled all CC transactions went down around the same time for a few days, for around 15 minutes. Tracked down the issue and the solution, which had been in place for years as explained by my old manager, was to contact one of the higher ups in finance to call the bank's IT department to get it fixed because we had 0 access to this router. Anyone who did could view any and all financial transactions that went through it.

My new boss, despite having been told this was the protocol and had been in place for years, told me to get the contact info from whomever had it and that I'd be the point person for issues like this, as non-IT departments shouldn't be calling third party IT departments. Told her I didn't entirely disagree with her, but we'd have to meet with everyone involved (pretty sure this included someone in a V level position in the finance department) to lay out a new chain of command for these issues. Told me to just do it, told her I wouldn't without the meeting, so she takes all financial apps I'm responsible for away from me right then and there.

Doesn't give me anything to replace the work I'm no longer responsible for, and terminates me about 6 months later saying I was wasting time on the tasks she did leave me and thus wasn't focused on improving and doing my job.

And that's only half the story.

You have a point in escalating further up the chain when needed, but I'd advise caution for anyone who's boss doesn't have their back, or is evidently easily expendable."
20,2017-01-01 04:48:59,I are ALL finance the first date on this blessed day
21,2017-01-01 17:45:20,"In olden times, about 10% of Ivy League grads went into finance. Beginning in the '80s, about 40% of the best educated, most talented students in the country started going into finance. Last year 47% of Harvard students said they planned on entering finance. Instead of physicists, you're producing bankers. Every second kid at Harvard or Stanford thinks they should be making $1m a year or have a series-A round before graduating. 

As a foreigner studying in the US in those days, that was the beginning of the end for me. It is, frankly, a shitty, plutocratic system."
22,2017-01-01 12:03:25,"BJP is a young party. They hardly had big leaders before Advani started his Ram Janmabhoomi movement. Wait for this generation to retire and you will see them in higher positions. 

Jayant Sinha was MoS for finance, and now MoS for Civil aviation, now that his dad retired. Anurag Thakur was made the BCCI Chairman. Once this older generation starts dying, you'll see the younger ones in higher positions. "
23,2017-01-01 13:40:59,"For me this was one of KC's weaker anti-hauls, but it was still a enjoyable to watch.  She essentially talked about the cheerleader effect with palettes and how luxury brands are selling mere gimmicks for luxury prices just because they can.  I thought the comparison of Sweet Peach to the Member berries was hilarious. 

As a side note, Beautylish has a payment plan?  Good god.  That is so disturbing.  Makeup isn't a car or furniture you need, or other things that make perfect sense to finance.  If you need to finance makeup in order to acquire it, you shouldn't be buying it."
24,2017-01-01 18:21:14,"Sure, you have to play with the cards you have, and you won't always have the   option to do things the way you like. The trick is knowing the system you have well enough to work it to your advantage. 

Given your situation, for example, if your boss is insistent that you do this despite your objections, your best option is to start laying the groundwork for following his instructions. Step one in that case would be to contact the finance manager of the appropriate level and ask for the contact details of the bank IT department. Such a request would almost certainly be shot down, but you're no longer the one refusing to do what your manager perceives to be your job. "
25,2017-01-01 03:20:23,"Toujours pas d'appel au don des sympathisants? Ce parti représente les intérêts des banquiers russes et maintenant du papa le Pen, mais toujours pas du peuple français, qui ne le finance pas et ne semble pas représenter grand intérêt pour ce parti sauf au moment de rembourser ses emprunts financiers (c'est bon? On est à plus de 5%?)"
26,2017-01-01 14:27:11,"Or more specifically,  move on from neoliberalism. 

I don't think Van Jone's description of Clintonism as ""moderates"" is accurate. They are corporatists and neoliberals. Even moderate Americans want the rich to be taxed more, univeral health care, against the TPP, want campaign finance reform, and less interventionism."
27,2017-01-01 20:49:51,"I don't even know where to begin telling you why this is not the case.  This is /r/badeconomics in a nutshell. 

(1) Citation about those recoveries that occurred without any government spending whatsoever?

(2) Citation that individuals were in the same position to stimulate the economy as a whole as was the government?

(3) This is just some dumb bitcoin libertarian nonsense talking point that doesn't hold up to the slightest scrutiny.  

(a) Market inflation is inevitable, at least as long as markets are not completely closed systems.

(b) When bonds come due, governments simply issue more bonds to finance their redemption; they rolled over the debt.  That’s what happens in 99% of the cases in every modern economy, and you can see this by looking at how small and infrequent fiscal surpluses actually are.

(c) All government economic activity is about borrowing from some people to pay other people, and paying back these debts -- should it ever happen, which it will not -- simply reverses that flow.  Either way, money is transferred from one group to another at the same point in time.

(d) Austerity would have been the worst of all options, as European countries that leaned into austerity like Spain demonstrate.  If capital markets are frozen because nobody in the private sector has an incentive to spend for fear of devaluing their currency holdings, then *nobody will spend anything, ever.*

(e) The amount of 'borrowing' (either from other countries or the nebulous future) to finance fiscal deficits is not any kind of direct function of the deficit size but of whatever determines the government's position for repayment -- that is, current and capital accounts.  It might be true in some circumstances, but to make the case that government borrowing automatically increases the account deficit, you have to, you know, actually make the case instead of supposing it.

(f) Obviously, deficits aren't completely great or free of problems. The selling of bonds and the permission structure that allows those bonds to be fulfilled have to be stable, but that's far less difficult than the converse -- where private markets have to spontaneously find the means and incentives to pull themselves out of a spending freeze without any government-backed guarantees in the form of bonds.

**For individuals, borrowing is truly borrowing from the future since their repayment must occur in a closed system -- their own finances.  At the population level, borrowing is necessary to create assets and liabilities across different people, times, markets, and material circumstances.  Those two are not the same.  Your argument relies on an analogy that does not hold up to even the slightest scrutiny.**"
28,2017-01-01 17:52:54,Engineering or finance
29,2017-01-01 11:57:26,"I found this article http://qz.com/500003/the-painful-hidden-hell-that-awaits-mothers-who-return-to-work-two-weeks-after-giving-birth/

It makes me feel really sad 

Also http://www.kidspot.com.au/birth/trimesters/pregnancy-work-and-finance/could-you-return-to-work-2-weeks-after-giving-birth-these-mums-had-to"
30,2017-01-01 04:25:50,Nope I get it. I was extremely extremely angry. He and I are diametrically opposed when it comes to personal finance. I make $180k and I'm opening my McDonald's app right now so I can get $2 off of a 10-piece nuggets. He has zero extra spending money but thought it was clever to fund a car loan with a 135% payday loan. And he's 40 years old.
31,2017-01-01 11:04:01,"I don't think so. I'm assuming that by 'our generation' you mean millennials. But here is a few reasons for thinking that you may be wrong.

* You base much of your hypothesis on the rejection of consumerism, but there is a large part of the self-labeled minimalists that do not abide by this at all. Look at this subreddit even, users are so split on whether it should be about art or lifestyle. in a twist of irony, you've tagged your own post art, further calling out this dichotomy. And so many of the lifestyle posts on this reddit are some variation of ""I want a new minimized _product_, despite my current one being fully functional. Help me pick out an expensive aluminum one"". Subs like /r/anticonsumption and /r/simpleliving are much less popular.

* I don't subscribe to the ""minimalism is only for rich people"" thought, but the most public leaders of the minimalism movement come from rich backgrounds. The minimalists movie for example, those guys had 6 figure jobs before they started the whole thing. And now they've just made a movie that seemed to me to be an ad for their book. This takes away from the central, less sexy, message of minimalism of ""less is more"" and makes it seem less accessible for people. 

* Gathering experiences instead of things is still incredibly commercialized. Many experiences people seek out are simply for social status reasons, similar to goods. What is the difference between spending a ton of money on a watch to post on instagram and spending a ton of money on an incredibly commercialized music festival to post on instagram? To me there is no difference. 

* Personal experiences with my peers tells me that this isn't a huge thing among younger millennials. I feel like I have a wide range of friends, from broke musicians to farmers to people doing very well in technology and finance. Everybody still wants a new toy and has crap they don't need (myself included). It just doesn't feel like a large thing. Everybody knows what it is of course thanks the countless empty-room and kitschy self help blogs out there, but to many young people that's exactly what it feels like - empty rooms and kitschy self help blogs.

Just some thoughts"
32,2017-01-01 12:20:19,"I went to Torres del Paine and El Calafate for the following week (second time, I went 15 years ago as well), and while there's absolutely a lot of extremely pretty scenery there, I enjoyed my time on the Carretera Austral more. I agree that few places compare to the magnificent granite towers of Paine and, further north, Fitz Roy, but they are far from the only hugely scenic spots in Patagonia. 

Arriving in Coyhaique felt much like arriving in Puerto Natales 15 years ago. There's a bit of that final frontier atmosphere to be had, which simply is just not there in Puerto Natales anymore. We had a meal at a pizzeria, and I swear that every single other seat in that pizzeria was occupied by a US citizen wearing brand new hiking boots, cool sunglasses and a North Face winter jacket. There's of course nothing wrong with that, I'm just putting it forward as ""proof"" that Torres del Paine is currently THE place to go for a lot of tourists, even though there are amazing alternatives nearby, where the ""in-crowd"" tourists are hardly seen. 

Another factor to consider is that unless you're on a short trip, or you're extremely good at planning long-lasting trips, and sticking to that plan, Torres del Paine is almost a no-go zone these days. You have to book every camp site or other accommodation in the park, or even near the park, months in advance. And the rates that a few days at even a simple hotel room go for could finance weeks and weeks of travel elsewhere in South America. 

I'm not trying to make people stop going to Torres del Paine, by all means. I'm just suggesting an alternative that some travelers may not have considered, because they don't know about it.

That said, here are some examples of the kind of scenery you will find along the Carretera Austral, well worth image-googling:

- Cerro Castello Patagonia
- San Rafael glacier
- Jeinimeni national reserve
- Parque Queulat
- Glacier O’Higgins

Enjoy wherever you go! :)
"
