,created_utc,body
33,2017-01-01 19:42:36,"This reminds me of a couple years ago when my daughter was only about 2 months old and it was new years day at 6.30AM and my work mobile was ringing out in the kitchen which I could barely hear it except the wife nudged me to ensure I heard it. Not long after it stopped ringing my personal mobile is ringing and I didn't recognise the number so I ignored it.

Turned out to be the Finance Officer at work wanting to do end of year tasks before she went on her overseas holiday. Over the Christmas new year period a power supply for a fibre media converter had failed causing no network connectivity in that particular building.

I was not very pleased considering she knew I had a new born child. She has had two children herself and would know that sleep is scarce and the fact that it is New Years Day FFS. I don't give out my personal mobile number to work colleagues for these exact reasons and this Finance Officer definitely didn't have it and must have gone through the Boss's Personal Assistant's records to find my personal number which is there for the PA to call me in emergencies only. I made sure the Business Manager &amp; Boss knew about it all when they came back to work."
34,2017-01-01 09:57:33,"&gt; Former finance minister Yashwant Sinha’s son Jayant is an MP from Hazaribagh.

After 2014 (from when the rediff article is) Jayant Sinha went on to become the Minister of State for Finance and subsequently became the Minister of State for Civil Aviation"
35,2017-01-01 13:47:30,"I get a sense that the most posters on /r/finance are too young to experienced major drawdown in their savings/investment accounts.

p.s., how diversified is your portfolio when you are up 13.5% for the year but S&amp;P only up 11% and aggregate bond is basically flat. Lucky DCA schedule or market timing a bit during the two big drawdown event in 2016?"
36,2017-01-01 12:33:21,"Yup, i work in finance and some of our methodology is so outdated but it's what my boss knows lol"
37,2017-01-01 18:50:33,"That agrees with my comment. 2034 is only 17 years away. Either benefits decrease or another source of funds has to be found

http://www.bankrate.com/finance/retirement/future-of-social-security.aspx "
38,2017-01-01 10:31:52,That's fine if those are your plans long term but you can't expect to turn down work and then have unemployment finance your move. 
39,2017-01-01 19:15:24,They've literally been firing all their lifelong employees and replacing them with finance people from Brazil. They've become such a shitty company. The sad thing is they're making millions driving it into the ground.
40,2017-01-01 21:29:52,"Inexpensive when it first came out. Now it goes for upwards of $450 on Amazon.

You can finance it if you have an Amazon Store Card.

Typing that out made me feel a little sick in my stomach."
41,2017-01-01 13:22:53,"As someone in finance, I see your point but also see this type of product as a game changer.  If a new set of trucks were made that actually were better than anything existing by leaps and bounds, that company would pretty much take over the globe in terms of truck sales as they'd hold the patent.  I think it'd be near impossible to accomplish, but hey, if these guys want to keep trying to innovate, that's good news for everyone in the long run."
42,2017-01-01 18:02:47,"If she's not pregnant, visit the personal finance subreddit and figure out where the heck your money is going. Same advice if she is pregnant, I guess. "
43,2017-01-01 18:26:28,"I think history has proven that Hamilton was right in both instances. 

State debt is obvious but remaining neutral is maybe less obvious to some.
Getting involved would have cost the US a lot of trade agreements and war is extreamly expensive.  

Trade was extremely important and America's finance was still very fragile. 
The whole first government was fragile and history could have easily been entirely different."
44,2017-01-01 07:26:58,"You are absolutely correct, there were ATM withdrawal limits. 

However, you could still withdraw from the banks. Right now, you can't. The government intentionally wants to keep the money in the banks. 

According to our ~~honorable finance minister~~ Arun Jaitley, there is no cash crunch 'at all'. Then what exactly is the rationale of having limits? Please don't say 'digital india', we hardly have any infrastructure and it is a good decade away."
45,2017-01-01 15:13:59,"This is the best tl;dr I could make, [original](http://www.veteransnewsnow.com/2016/12/25/1012891cia-has-interfered-with-over-81-foreign-elections-in-the-past-century/) reduced by 88%. (I'm a bot)
*****
&gt; Russia attempted to sway 36 foreign elections from the end of World War II to the turn of the century - meaning that, in total, at least one of the two great powers of the 20th century intervened in about 1 of every 9 competitive, national-level executive elections in that time period.

&gt; Throughout the Cold War, U.S. involvement in foreign elections was mainly motivated by the goal of containing communism, said Thomas Carothers, a foreign policy expert at the Carnegie Endowment for International Peace.

&gt; The New York Times reported in the 1990s that the CIA had on its payroll members of the military junta that would ultimately unseat Aristide after he was democratically elected in a landslide over Marc Bazin, a former World Bank official and finance minister favored by the U.S. The U.S. also attempted to sway Russian elections.


*****
[**Extended Summary**](http://np.reddit.com/r/autotldr/comments/5lgwcy/cia_has_interfered_with_over_81_foreign_elections/) | [FAQ](http://np.reddit.com/r/autotldr/comments/31b9fm/faq_autotldr_bot/ ""Version 1.65, ~41849 tl;drs so far."") | [Theory](http://np.reddit.com/r/autotldr/comments/31bfht/theory_autotldr_concept/) | [Feedback](http://np.reddit.com/message/compose?to=%23autotldr ""PM's and comments are monitored, constructive feedback is welcome."") | *Top* *keywords*: **election**^#1 **U.S.**^#2 **Levin**^#3 **campaign**^#4 **include**^#5"
46,2017-01-01 15:11:47,"Yeah, get used to Stannis burning his daughter because George confirmed it's happening in the book. The only difference being we will probably hear Stannis' inner monologue about what's happening. As for his tactics he says plenty of times he won't run and be known as ""the king who runs"" his lack of men and lack of finance, what would he do? Return to the wall and have all the events leading to what happens to Jon just not happening. The northern lords wouldn't ever support Stannis so he would always been in the same position and he would die one way or another. However as for the Brienne thing I agree it's total shit she ""kills"" him and declares Renley is the true king when he never was. 

As for Barristan there's no way of knowing that exact day is the day the sons will come out and slaughter unsullied, yes there is always a risk of an attack but he's the best Swordfighter in the world so there's no way he couldn't handle himself. He didn't have any armour since removing it in season 1, they could of made him some but then you run into production budget. You also have to think that Selmy went without his armour to sounds of conflict (a noble and brave thing to do) and then on top of all that almost killed every one of the sons of Harpy in front of him. Yes he died in a back alley to unknown people but not every hero dies valiantly in a battle or duel and his death shows that.  

As for Blackfish he got the Stannis treatment, they didn't show his death on screen just in case they want to bring him back in later (yes it's unlikely this will happen with either but it could happen). Also how long do you think these old knights and commanders could last in the long night? The walkers come and these slow men would die by the dozen so there's not any reason to think they could get a more honourable death elsewhere. 

Overall you have to remember D.B and D.B.W are following guidelines laid out by George so in his next book (whenever that comes) I'm expecting a lot of this to happen. "
47,2017-01-01 07:57:12,"TIL financial hygiene 

http://www.military.com/money/personal-finance/good-financial-hygiene-basic-tips-and-best-practices.html"
48,2017-01-01 11:58:55,"Personally, I have no problems with dynasts in BJP. Most of them are more competent than those who have been educated in RSS shakhas who tend to have dangerous far-right ideologies. I was responding to Poonam Mahajan's hypocrisy. But to call BJP a party which selects dynasts on merit would be very naive. 

Also, what qualifies as top leadership? Does BJP not have intra-party democracy? Top leadership excuse for dynastic politics would be applicable if we lived in a dictatorship. Some of these BJP leaders promoting their relatives are cabinet ministers. They have a lot of say within the party and have a lot of support in their constituencies. Modi cannot fire people at will. 


&gt;Thirty two-year-old Abhishek Singh, BJP’s candidate from Rajnandgaon in Chhattisgarh, is a post-graduate from XLRI Jamshedpur. His political experience is limited to assisting his father, and yet, he edged out the current BJP MP from the constituency, Madhsudhan Yadav. A senior leader who won the 2009 elections with a thumping margin of 119,074 votes, Yadav stood a bright chance of winning again, according to political observers in the state. “But it was difficult to turn down Abhishek’s name since Ramanji has won three elections for the party,” said a BJP leader in Chhattisgarh, on the condition of anonymity.

&gt;Another chief minister who wrested three victories for BJP could be similarly rewarded. Shivraj Singh Chouhan’s wife is likely to get a ticket to contest the Madhya Pradesh assembly by-election from Vidisha. In the assembly polls in December, Chouhan had contested and won from two constituencies – Budhni and Vidisha. He retained Budhni and gave up Vidisha. But it appears the constituency might well remain within the family.

&gt;You don’t need to win three consecutive elections for the BJP to get a party ticket for a family member. Jayant Sinha, the son of Yashwant Sinha, a senior BJP leader who has served as India’s finance minister, is in the fray from Hazaribagh in Jharkhand. An alumnus of IIT and Harvard Business School, 50-year-old Jayant Sinha has had a long and successful corporate career, but as a disgruntled BJP worker told Hindustan Times, “Degrees from international universities are no criteria to become a popular politician and good administrator.”

&gt;Another political scion fielded by the BJP is Anurag Thakur, the son of former Himachal Pradesh chief minister Prem Kumar Dhumal. Anurag Thakur has been re-nominated from Hamirpur, which he won in 2009.

&gt;Dushyant Singh, the son of Rajasthan chief minister Vasundhara Raje, is also likely to get re-nominated from Jhalawar constituency. Dushyant Singh won the assembly polls in 2004 and the Lok Sabha polls in 2009.

&gt;A BJP spokesperson, who did not wish to be named, said the party could not ignore the ""winnability"" of political scions. But that does not explain why even those who have lost elections for the party have been rewarded with tickets. Poonam Mahajan, the 33-year-old daughter of late Pramod Mahajan, has been nominated by BJP from Mumbai North-West constituency, even though she lost the 2009 assembly polls by a margin of 24,966 votes.

[Where is the merit here?](http://scroll.in/a/658714). BJP is kicking out more competent candidates in favour of dynasts with no political or administrative experience. "
49,2017-01-01 00:19:41,100% agreed. Personal Finance as a GE requirement would help kids so much more than some other classes I can think of. 
50,2017-01-01 12:35:14,"Some good snark I heard:

If someone says they went to the top business school in the country, they went to Stanford or Harvard. 

If someone says they went to a top three school, they went to Wharton. 

If someone says they went to a top five school, they went to Booth (Chicago), Stern (NYU), Ross (Michigan), Sloan (MIT), or Haas (Berkeley). 

If someone says they went to an ""M7"" school, they went to Columbia. 

If someone says they went to a top ten school, you have no fucking idea where they went to business school. 

And if someone complains about their old finance professor who spent all his time blogging and shitposting on reddit and never actually did research or taught, they went to Stony Brook. "
51,2017-01-01 15:49:56,"&gt;harder to heal those wounds with the (Bernie) Sanders and Elizabeth Warren wing

I never became foaming-at-the-mouth angry with Warren and her lack of backbone during the primaries (and since), but I am getting sick of everyone labeling progressive democrats as ""the Sanders and Warren wing"" of the party.  Stop trying to make that happen, democrats.  Warren is good on finance, and that's about it.  When it comes time to put up or shut up, she shuts up, so I really wish they would stop giving her credit where credit is not due.  

I can't be alone in feeling this way, can I?"
52,2017-01-01 11:54:35,"Let's say that madman theory is the notion of instilling fear in adversaries by demonstrating a high capacity for destruction and a marginal capacity for self-control. To me, this isn't really a theory; it's a practice or doctrine. It should be called the Nixon Doctrine.

Anyway, the Saudi/Wahhabist establishment may been applying this. Al Qaeda went international and became known to the CIA in (it so happened) the year 1990. The royal Saudi hierarchy and power structure is fairly opaque, but terrorism seems to be a hobby of its fringes, who need to be reined in by the diplomats.

For what it's worth, Russia [has accused](http://www.telegraph.co.uk/finance/newsbysector/energy/oilandgas/10266957/Saudis-offer-Russia-secret-oil-deal-if-it-drops-Syria.html) the Saudis of using Al-Qaeda affiliates as a stick:

&gt;  “I can give you a guarantee to protect the Winter Olympics next year. The Chechen groups that threaten the security of the games are controlled by us,” he allegedly said."
53,2017-01-01 14:13:36,"I'm probably a unique case here.  I'm the 41yo single dad of a 22yo boy.

I started out as a teenage parent, living in subsidized housing and using WIC checks, and then became a single parent.  I used federal student loans and a massive amount of personal finance to go from public assistance to buying a home in ~6 years, and ~20 years later I've paid far more back into the system than I took from it.

For years after my son left for college, I didn't know what to do with myself.  This year I actually started getting hobbies and vacationed by myself.  Next year is actually looking good for me, as I will be selling a house and some stock that should total ~$400k cash at the end.  The house I live in is paid off, and it's a two family which provides income from a tenant family that's unlikely to move any time soon.  My son's college already has money set aside for it.  This first family that I was a part of seems to have run its course.

My financial goal for next year?  To start a new relationship so that I'm not spending holidays alone until I'm an old man.  Lol...this might not seem like a personal finance goal, but money sure does seem to be involved.

For example, the old/abused vehicle that I'm driving right now, is likely the wrong choice for picking up a date.  And although I have a lot of people telling me ""losing your hair isn't a big deal,"" it is to my confidence and it's a matter of money to fix that problem.  In general I'm going to need to get used to spending money during the dating process...ugh...but at this point my mind is so settled into the ""minimize weekly shopping expenses"" mode.

Here's a another question: could I possibly have accumulated enough at this point, if I find someone and they want a family, I might be able to be a stay-at-home dad?  I'd *love* a chance to do that if I could.  I did the best I could as a single dad, but it killed me to see all the ways my son suffered as a result of me having to take two roles.  I have a modest 401k and no debts, but my stock sale next year should be guaranteed and the real estate agents I interviewed had data showing my house should sell quickly.

I'd sort of like to ask this as a question by itself, but I'm unsure of if it's appropriate for /r/personalfinance in the first place."
54,2017-01-01 16:24:04,"The new owner, Mike Charlesworth came in towards the end of Arnie's reign and has since taken a bottom up approach towards reshaping the club and its finances.

Arnie left the club in a financial mess and the wages weren't sustainable, despite the on field success. Having said that, somebody had to greenlight all of his finance related requests, so it wasn't just him. 

During the the tenures of Phill Moss, Tony Walmsley and now Paul Okon, Charlesworth has worked to reduce spending and increase revenue in order to balance the books. A lot of this was done when Walmsley was at the club and it has been well documented that CCM has been spending the lowest amount of the allocated salary cap in the entire comp. 

So as far as the on field performances are concerned, you can only play the cards you are dealt and the cards were not good. However, with news about CCM wanting to purchase Central Coast Stadium and also looking to implement a W-league team, it can be noted that Charlesworth isn't afraid to invest in the team, he just wants it to be sustainable at the same time. He's building the foundations now, before more expansions occur and farther down the line, relegation. 

The goal of producing young talent to then sell on to an overseas club is still prevalent and in my opinion, wisely so due to the nature of our league and the small size of the central coast population. Praise has to go to the CCM fans who are still attending matches because it can't be easy, but i'm sure their patience will eventually be rewarded. If the team ends up reaching the lofty heights of their past it won't be for a few years yet, but at least they'll be able to pay their players during the championship season. I remember reading Arnie had to write a few cheques to some of his players...

If any proper CCM fan wants to comment or disagree, be my guest, I just have a soft spot for this team and have followed them very closely. Also forgive my formatting/spelling, i'm on my iphone.


"
55,2017-01-01 20:18:59,How does this have anything to do with finance?
56,2017-01-01 16:20:57,because roblox needed more income to finance giving out way too much DevEx money to people who make trash.
57,2017-01-01 21:44:32,"My  (required) Economics class in HS was basically personal finance. It was amazing. 10 years later I've managed to stay out of trouble because of it, with a perfect credit history. I think I've paid about $15 in total credit card interest in my entire life. 

The most useful advice my teacher gave us was to ALWAYS CALL the people you're dealing with. They're surprisingly helpful. Any time something fell through the cracks and I missed a payment or anything like that, a quick polite call usually got it all sorted out. CC companies have refunded me interest and late payment fees more often than not. And a call after getting rejected for a card has always resulted in me eventually getting it. "
58,2017-01-01 23:35:33,"[You know you're not in high finance,  considering second-hand underpants...](http://vignette4.wikia.nocookie.net/flightoftheconchords/images/4/49/1x02_-_Inner_City_Pressure.jpg/revision/latest?cb=20090217030946)"
59,2017-01-01 02:55:33,"Holy shit, youtube does not disappoint. One of the comments instantly caught my eye...

&gt;its about the zionist who had control over turkiye and the world. how Erdogan try to end this in turkiye and the problems he suffer while doing this. Bc you need to know, zionist are in Turkiye since Ataturk....80 years now...they are in politic, finance, military, law, busniesman, universitay,,,everywhere....and there are  also Armenians who have hide here true identity. bc the deportation in 1915...Erdogan is fighting the world all alone...

I don't know what scares me more, the blatant paranoia and racism or the seemingly unconditional loyalty to mr. Erdogan."
60,2017-01-01 13:52:13,"I inquired at 10 or so east coast dealers before purchasing my R. Not a one quoted a premium. West coast seems to have this problem more than us though. MSRP is achievable with no negotiation and no trade/finance. If you want to haggle further, you can, just depends what your time is worth for $500-$1000 off. YMMV."
61,2017-01-01 19:40:13,"This is a long process and will not happen until youre at your first duty station.  You must show that you are paying all her bills and theres other paper work that has to be done.   Its a massive hassle but it can be done. 

--edit

Are you at your first duty station?  Let your squad leader know the situation and that you need to goto the finance office.  

-edit 2

Dont try to have your mother in your dorms.  You'll get slapped with UCMJ and be the laughing stock of your unit. "
62,2017-01-01 12:24:42,"&gt; OP needs to seek out a trained financial adviser.

Don't. Financial advisers are mostly just salesmen, and most sell shitty products with high fees. It's impossible to navigate which ones are good and which ones aren't unless you know finance yourself, in which case, you will no longer need a financial adviser and can invest yourself for the lowest fees (use Vanguard for the lowest fees).

 It's really not all that complicated to invest if you play the game of diversification and just try to get the average market return. Trying to beat the market is another game (a game which we who are interested in bitcoin are playing) and takes another level of sophistication. 

Just read these two books and you'll know all you need to know to invest your own money well for the lowest fees. That is if you're playing the simple diversify-and-get-average-market-return game.

[The Investor's Manifesto: Preparing for Prosperity, Armageddon, and Everything in Between](https://www.amazon.com/Investors-Manifesto-Prosperity-Armageddon-Everything/dp/1118073762/ref=sr_1_1?ie=UTF8&amp;qid=1483290974&amp;sr=8-1&amp;)

[A Random Walk down Wall Street: The Time-tested Strategy for Successful Investing](https://www.amazon.com/Random-Walk-down-Wall-Street/dp/0393352242/ref=sr_1_1?ie=UTF8&amp;qid=1483291057&amp;sr=8-1&amp;keywords=random+walk+down+wall+street)"
63,2017-01-01 06:48:55,"At the end of the day, McCain, as part of Senate leadership, holds the pen of power on the declaration of war and the finance of the government.

If Trump pisses off senate leadership enough, they can defund and overrule his mechanisms of power."
64,2017-01-01 23:36:38,"I feel that a generation of children felt more financially empowered about real world finance once they found out they didn't HAVE to grind a 99 out for usable cash. Interesting how a game can put the concepts of fiscal responsibility + money management onto the top of a kid's priority list; where I've seen many parents fail to/unwilling to teach.


Also probably partial covering for the crazy amount of time I put into it."
65,2017-01-01 17:51:45,Could you explain how this could get an embezzler caught? / Not in finance.
66,2017-01-01 22:36:25,"The LDS continue to pursue Growth.  They need the cash flow coming from new members to sustain their real estate and other investments.  Absent the Tithing cash flow, they would have to turn to the bond and markets to finance their real estate ventures.  

Mainline faiths recognize that religion's place in the world has been alterned and are pursuing service and mission, rather than growth.  It's about the quality of the programs and being a small, but more effective, force in the world.

Frankly, even if the LDS could achieve a measure of reactivation, they would never be able to withstand the pressures coming from newly activiate members who come back into the faith willing to challenge the status quo.  There is no way I could sit there and not call them out the Seer Stone nonsense.  "
67,2017-01-01 22:41:45,"thanks so much for the wise tips beejay247, I actually have a plan, it's a bit crazy, I created my dream job, don't laugh ok? here we go! https://www.youtube.com/channel/UC9UW9W6GOZGk3nMrHqe-znA it's a crazy idea, but i love journalism, travel, video and entertainment, so I created a sort of tv show on youtube, i was thinking about quitting my job at Reuters to go husband hunt around the world, i still need to figure out how to finance my trips, it sounds so crazy i know"
68,2017-01-01 08:44:17,And that's why MMS was a great finance minister but a bad PM who had his leash in someone else hands.
69,2017-01-01 19:43:36,"Business students don't have to take Calculus and the CS course that's required is dumbed down compared to what the other students have to take but it still isn't easy by any means 

I'd say the bigger problem is the lack of diversity in majors. Unless you want to do HR or marketing you're still going to have to take pretty high level analytics type courses for most of the other concentrations for a business degree like Finance or Operations.

There aren't really any handout degrees like Communications and our Liberal Arts school is just kind of there."
