,created_utc,body
70,2017-01-01 13:27:23,"&gt;Not all financial advisers are salesmen in the way you're trying to imply.

98% are, and someone who doesn't know finance won't know the difference. The problem with the industry is the profit motive. It's much more profitable to sell high-fee products than to try to do the right thing and charge your clients a flat fee to manage their money. I know this because I was used to be in the industry. 

Being a financial adviser is a very difficult profession. It's almost impossible to launch a career doing the right thing. It's much easier to make it when you can make many thousands off each client by selling them a high-commission product. 

The reason is two fold. First, it's much easier to convince someone to work with you if they don't have to pay you directly. Commissions are somewhat hidden from the consumer and consumers are conditioned to pay them without thinking about it too much. It's much more difficult to get a client to understand that by paying you $100 an hour, they'll pay less in the long run.

Second, clients are *very* hard to acquire. There is intense competition and marketing cost a lot of money. So if you can make 3-10x more money per client by offering a high-commission item, you'll be much more likely to make it in the industry. It's survival of the fittest and it's about the survival of the adviser, not what's in the best interest of the client. Guys with good intentions die off much faster than guys who look after their bottom line first. 

There is massive infrastructure and marketing organizations available to guys who sell high-commission items. There is very little support available to the guys who charge by the hour for advice. They are on their own and are at a big disadvantage in the marketplace. As such, 98% or more of financial advisers are nothing more than salesmen who sell expensive products.

Sorry pal, I know the red pill is hard to take, but this is the way things are in the financial services industry. Research it for yourself, it won't take you long to find out that I'm right. It just is the way it is. The world is not a kind place and the profit motive corrupts many industries. Finance is one of the worst.

Edit: I just want to add that most financial advisers don't know that they are nothing more than simple salesmen. Field marketing organizations spend a ton of money each year to pour their advisers a ton of kool aid to condition them as thoroughly as they do the consumer. Most don't have a background in finance and are just doing what they think is right. They usually get hired by an FMO to get their start and the FMO trains them in their way of thinking that maximizes the goals of the FMO. FMOs spend millions on world-class copywriters to craft a persuasive narrative that the advisers can stomach and pass on to the consumers."
71,2017-01-01 15:39:23,"&gt;however, cars are everything for me 

Cool, since you're driving more than everything you have.  Who on earth would finance a $50,000 vehicle for someone earning $1,000 a month?

&gt;i'm okay with paying 500$ a month - as i said it was a dream.

You shouldn't be, since you're going to be owned by this vehicle and your parents are effectively being forced to buy this toy for you in the form of rent and living subsidies.  The consequences of this are that you're going to have few options in life for the next few years.  You're driving a college education, a downpayment on a home, a (few) world trips, or about $2,000,000 in retirement.  The magnitude of the stupidity of this decision seems to be lost on you. 

If you are told they need to resign paperwork, get out of this deal.  Otherwise, I'd be selling the car ASAP and would extricate myself from this and chalk up whatever you lose to ""stupid tax""."
72,2017-01-01 01:30:53,"I don't know about equally astronomical, but the average salary for first year after graduation is supposed to be around 95-120k and it turns into ~150k or more in a couple years down line as you gain more experience or open your own practice. That starting salary is would be just fine for me since I'll have around 250k of debt, but even with that salary it'd take a lot of work to dig out of 500k of debt. Why go into it then? ""Because we're passionate about the field"" should be the only right answer. Yeah we'll be able to live comfortably, but you can do that with jobs in the computer science or finance field that don't saddle you with so much debt and don't take another four grueling years of education after a bachelors degree. "
73,2017-01-01 00:37:17,"It was inevitable that Fate will be a massive franchise when the news of FGO being the top revenue grossing app in Japan started appearing on Finance news outlets like Bloomberg and WSJ. 

FGO literally revived the Fate franchise, every servant released in FGO generates millions of US dollars and Sony is pushing Type Moon to release more and more Fate products."
74,2017-01-01 13:34:26,"Keep the loan for at least a year if you really want it to help your credit.  You don't ""have"" to keep the loan for any period of time.  If you overpay, it shortens the term, it doesn't lower the payment.  A finance manager didn't know how that works?
  "
75,2017-01-01 21:34:58,$400k invested in buying shares of [VTI](https://www.google.com/finance?q=NYSEARCA%3AVTI) or [SPY](https://www.google.com/finance?q=NYSEARCA%3ASPY) in the past year would have grown by $50k plus dividends paid of about $7k.  Damn that would be sweet.
76,2017-01-01 06:24:19,"&gt; I said that you can observe the failures of the ISF's advance into mosul, and easily deduce that their rushed their offensive. They didn't clear the areas they took before an advance, and they didn't prepare for counter attacks.

Your logic = ""some people died, therefor they were totally unprepared."" What's an acceptable number of casualties for a mission of this scope? 100? 50? 0? **Why have you still not linked me anything saying the Iraqis were ill-prepared for what they found?**

&gt;That's an article from two years ago, and it's just Abadi trying to play the two major players off each other for more resources.

It's not worthless at all. Political support for ANYTHING in Iraq has been dwindling over the past few years and it's crucial to US interest to have a leader in Iraq that is loyal to the US, and not Russia. That's our entire fucking foreign policy strategy in the Middle East.

&gt;You're the only person who is saying that ISIS isn't a threat anymore. If ISIS isn't a threat, then there is no reason for the coalition to exist.

ISIS is a threat that is being dealt with. ISIS will cease to exist in the next couple years. ISIS is not a threat to the western world, ISIS is on a path to destruction, and has been since the US fucked out of Syria.

&gt;You greatly exaggerate what Al-Maliki was doing. He was practicing sectarianism within the government, and he deliberately diverted resources from Kurdish/Sunni areas to Shia. However he did not have an institutional agenda to genocide sunnis.

I was semi-interested in hashing this out with you, but I think you're delusional. You won't source any of your info, you'll only provide conjecture, and when I call you out on that conjecture you cry ""waaaah strawman"" and **still** provide no source.

You say that the Sunnis weren't being marginalized in Iraq? [Why the fuck were the people marching in the protests in Hawija in the fucking first place, then?](https://en.wikipedia.org/wiki/2013_Hawija_clashes#cite_note-BBC-12)

Also, 

&gt;However he did not have an institutional agenda to genocide sunnis.

lol

http://www.pbs.org/wgbh/frontline/article/in-their-own-words-sunnis-on-their-treatment-in-malikis-iraq/

&gt;Rafi al-Essawi was the minister of finance in Maliki’s cabinet, a figure who was “greatly respected” by many Iraqis, according to journalist Dexter Filkins. Almost exactly a year after Hashemi’s bodyguards were rounded up, Maliki’s security forces arrested Essawi’s bodyguards on similar allegations of ties to terrorism. The move triggered huge protests in Sunni parts of Iraq, because as Filkins said, “everybody knows Rafi al-Essawi is a peaceful man.” Fearing he would be arrested like Hashemi, Essawi fled to the Sunni-dominated city of Ramadi.

&gt;Maliki — he had to get rid of all Sunni politicians who were capable of saying no to him, his policies or his behavior. So it’s the story of attacking, intimidating, marginalizing, whatever you want, of Sunni politicians.

&gt;RAFI AL-ESSAWI: Thousands of Sunnis were arrested after the Americans left the country, tens of thousands in fact. They come to any district with a car bombing, for example. They’re collecting 200, 300 people and they stay in [prison] for years without a trial.

http://www.newyorker.com/magazine/2014/04/28/what-we-left-behind

&gt;For more than a year, thousands of Iraqis, nearly all of them members of the Sunni Arab minority, had been gathering to rail against Maliki’s Shiite-dominated government. Although the protests were mostly peaceful, security forces responded harshly, detaining thousands of Sunni men without charges and, in one encampment, touching off a spasm of violence that left hundreds of civilians dead. Across the Sunni heartland, north and west of Baghdad, the town squares filled with angry crowds, and the rhetoric grew more extreme. In Ramadi, protesters raised black jihadi flags, representing the extremist Al Qaeda offshoot that had dominated the city during the American occupation. “We are a group called Al Qaeda!” a man shouted from a stage in the protesters’ camp. “We will cut off heads and bring justice!” The crowd cheered.

http://www.aljazeera.com/humanrights/2013/03/201331883513244683.html

&gt;""I now want to explain to people what is occurring in the prisons that [Prime Minister Nouri al-] Maliki and his gangs are running,"" Heba added. ""I was raped over and over again, I was kicked and beaten and insulted and spit upon.""

Here's an entire report where you can download and read more of the fucked up shit that happened under Maliki. http://www.amnesty.org/en/documents/MDE14/001/2013/en/

&gt;Please cite Maliki's great transgressions against Sunnis in Iraq, and explain how they make ISIS a legitimate option for their revolution

Read above. I'm not going through the rest of your post, sounds like you have plenty of reading to do on your own, I have no desire to share it with you, especially when you refuse to source any of your own outrageous claims."
77,2017-01-01 15:20:11,What's your finance question? 
78,2017-01-01 16:47:56,"[The company's market cap is £981.21M](http://www.google.co.uk/finance?q=LON:GRG), so we could afford it in under 3 weeks."
79,2017-01-01 06:45:35,"State records start in 1870 (Baden), 1874 (Prussia) or 1876 (rest of Germany), unless your ancestor was from the area left of the Rhine, which introduced them under Napoleonic rule around 1800. Registrar's offices will keep birth records for 110 years, marriage records for 80 years and death records for 30 years; after that, the records are moved to the state archives. Churchbooks were kept starting from the 1500s, although many early ones were destroyed during the reformation and the 30 Years' War. Churchbooks are divided by religion (i.e. you have to know whether your ancestors were Evangelicals (Lutherans), Catholics or Jews). 

This means that if your ancestor emigrated in more recent times, you should start out by applying for any certificates you know the dates and places of by submitting proof that you are indeed directly related. This should give you the names of the parents - what's important is that you get past that magic data protection barrier. Genealogy is not a valid reason to retrieve records of people you're not directly related to (one exception, I think, is that you can apply for records of indirect ancestors if you are the closest related person, but I'm not quite sure about that). 

Once you reach the time before registrar's offices, state archives and church archives are the way to go. 

Large parts of Germany still live in the pre-digital era, and only a few regions (e.g. Hamburg) have agreements with sites like ancestry.com ($) and familysearch.org (free unless you order microfilms). Catholic archives are the worst, as they usually require you to be present at the archive and won't conduct research for you. I think that so far, only one or two bishoprics have digitalised and published their records.

The following sites may be helpful for German genealogy:

- [archion.de](https://www.archion.de/): Archion is an attempt of the *Evangelical* churches to digitalise all their records. You can look if your parish has already been digitalised. If it has, you can buy a subscription to browse the records. 

- [genealogy.net](http://meta.genealogy.net/): genalogy.net is the largest German genealogical site. It combines many databases and user-submitted data, and can easily searched via the link above. Mind that there may be more results than the site is able to display; if that is so, the affected databases will be listed at the bottom of the search results. The site also has a Wiki with resources for each place, and mailing lists that you can sign up for. 

- [verwandt.de](http://www.verwandt.de/karten/): See where your surname appears today!

- [forum.ahnenforschung.net](http://forum.ahnenforschung.net/): The largest German-language genealogy forum. The interface sadly cannot be changed to any other language, but you'll survive just fine with Google translate. Just post your list of surnames in the appropriate subforum and see if someone is related or can help you out (make sure you subscribe to your threads so as to get notified about any new messages).

One more thing you should know is that pre-1942 records will most definitely be written in printed [Fraktur](https://de.wikipedia.org/wiki/Fraktur_\(Schrift\)#/media/File:Vollst%C3%A4ndiger_Zeichensatz_\(ohne_Ligaturen\)_Koch-Fraktur.png) and handwritten [Kurrent](https://de.wikipedia.org/wiki/Deutsche_Kurrentschrift#/media/File:Deutsche_Kurrentschrift.svg) scripts, both of which may be difficult for foreigners to read. Hardly any Germans below the age of ~55 can read Kurrent without prior training. *I can translate any records you might find.*

In order to get further than the churchbook limit, you'll have to dig up old tax/tithe lists, local court records etc., which may exist either in local or regional archives.

**Q: Help, I cannot find a place called ""x"" in the region of ""y"", which is stated on my ancestor's immigration / naturalisation / shipping record!**

**A:** This is because the borders of back then are not the same as they are now. Take, for example, the Palatinate region, which is where a large percentage of immigrants came from: for a very long time, parts of this region was a Royal Bavarian exclave. Entering the place name in the German Wikipedia usually yields a list of possible results (make sure you find the disambiguation page for the place name).

**Q: I am looking for military records or a missing person.**

- For members of the former Wehrmacht, one can request all of their records with the [Deutsche Dienststelle \(WASt\)](https://www.dd-wast.de/en/tracing-request/private-matters-research.html). However, [it is not possible to obtain records of *surviving* combatants without their permission.](https://www.dd-wast.de/en/competence.html) It is only possible to obtain information on members of the former Wehrmacht who died either in the field or in captivity, and that only with permission from the next of kin. However, the Forum der Wehrmacht suggests that if the person in question has been dead for 10 years (even if they survived the war), the WASt will hand out info to the direct descendants. If the person had no direct descendants or the direct line has died off, it is also possible for the indirect line (nephews etc.) to obtain records; however, they need to be able to provide accurate info on the family status of the person in question. The costs for one record usually amount to about 20€, according to the website (a friend of mine paid 30). It depends on the difficulty and amount of records requested. The waiting time for a full genealogical inquiry might be more than 24 months, so it may be good to have a very distinct goal in mind, e.g. an inquiry into where someone's death certificate may be located. That reduces the time. If you want to know everything there is, make sure to mention in your application that you'd like the WASt ""to find out as much as possible about your relatives"" and that ""copies of records, letters and documents would also be welcome and that you are aware of the additional costs"" (copies are cheap, it's absolutely worth it). 

- The [German Red Cross Tracing Service](https://www.drk-suchdienst.de/en/initiate-tracing-requests) offers services that allow one to trace any missing person, be it civilian or military. This may not be the best place to look for military records, but it is a good start nonetheless. It also has a [""missing person photo search"" service](http://193.159.223.62:8081/vbl/), for which one only needs to enter some piece of information.

- [Federal Archive - Branch Office Ludwigsburg](http://www.bundesarchiv.de/bundesarchiv/dienstorte/ludwigsburg/index.html.en) (Central Office for the Investigation of National Socialist Crimes, e-mail: ludwigsburg@bundesarchiv.de): This archive houses data on units involved in war crimes, the scenes of these crimes, suspects and culprits, as well as persons who were mentioned in the investigations of said crimes. Therefore, it might be useful to check these archives if the searched person was part of units suspected of war crimes. 

- [Federal Archive - Department MA](https://www.bundesarchiv.de/bundesarchiv/organisation/abteilung_ma/index.html.en) (Military Archives): These archives house files on  
the Prussian army from 1867 onwards  
the army of the North German Confederation  
the Imperial Navy  
the colonial protection force and the Freikorps  
the Reichswehr, Wehrmacht, and Waffen-SS  
the German work units in the service of the allied forces  
the National People's Army, including border troops  
the Bundeswehr  
However, this needs to be taken with a grain of salt - the Department MA has lost vast amounts of its files due to war. Most of the files are war diaries written by army commanders and files on the navy. 

- Federal Archive - [Department R \(Reich\)](http://www.bundesarchiv.de/bundesarchiv/organisation/abteilung_r/index.html.en): Last straw. Has the largest pool of documents (from almost all eras), but these are mainly of a civil administrative nature (justice, finance, etc.).

- [Volksbund Deutsche Kriegsgräberfürsorge e. V.](http://www.volksbund.de/en/volksbund.html): Useful for looking for war graves. "
80,2017-01-01 20:05:00,"Pahleeze.  Here's just one way the Dem primary was rigged.  The superdelegates were created to weigh in if neither candidate was able to accrue enough delegates to outright win.  Hillary purchased hundreds of superdelegates through her [Hillary Victory Fund](http://www.dailykos.com/story/2016/4/6/1511462/-CORRUPTION-How-Hundreds-of-Superdelegates-were-Literally-bought-by-the-Clinton-Campaign) which skirted campaign finance laws and was allegedly created as a joint fundraising vehicle with the state parties.  She bought their allegiance and ended up stiffing them giving them [only 1% of the proceeds.](http://www.politico.com/story/2016/04/clinton-fundraising-leaves-little-for-state-parties-222670). The [DNC tried to hide the details of this arrangement.](http://www.politico.com/story/2016/07/dnc-leak-clinton-team-deflected-state-cash-concerns-226191)

In states where Bernie won and won big sometimes, the superdelegates were counted in (including [lobbyist superdelegates](https://theintercept.com/2016/02/17/voters-be-damned/) for her for crissakes) and she often walked away with more delegates than Bernie, thus **OVERTURNING THE WILL OF THE VOTERS.**  He beat her ass by a whopping 22-points in New Hampshire, and they walked away with the [same number of delegates](http://www.politicususa.com/2016/02/10/thanks-to-superdelegates-hillary-clinton-still-wins-after-getting-crushed-in-new-hampshire.html) because the superdelegates from that state were counted in for her. 

In Wyoming, he beat her by 12 points and she walked away with 11 delegates and he 7.  [Here's Jimmy Dore weighing in on that.](https://m.youtube.com/watch?v=2WS2tG5qcBE)

"
81,2017-01-01 02:38:31,"That reminds me of when [Lin-Manuel Miranda created a one act musical based on a single run-on sentence.](https://youtu.be/xuVip8tDS30) 

&gt;Look, having nuclear—my uncle was a great professor and scientist and engineer, Dr. John Trump at MIT; good genes, very good genes, OK, very smart, the Wharton School of Finance, very good, very smart —you know, if you’re a conservative Republican, if I were a liberal, if, like, OK, if I ran as a liberal Democrat, they would say I’m one of the smartest people anywhere in the world—it’s true!—but when you’re a conservative Republican they try—oh, do they do a number—that’s why I always start off: Went to Wharton, was a good student, went there, went there, did this, built a fortune—you know I have to give my like credentials all the time, because we’re a little disadvantaged—but you look at the nuclear deal, the thing that really bothers me—it would have been so easy, and it’s not as important as these lives are (nuclear is powerful; my uncle explained that to me many, many years ago, the power and that was 35 years ago; he would explain the power of what’s going to happen and he was right—who would have thought?), but when you look at what’s going on with the four prisoners—now it used to be three, now it’s four—but when it was three and even now, I would have said it’s all in the messenger; fellas, and it is fellas because, you know, they don’t, they haven’t figured that the women are smarter right now than the men, so, you know, it’s gonna take them about another 150 years—but the Persians are great negotiators, the Iranians are great negotiators, so, and they, they just killed, they just killed us.  "
82,2017-01-01 16:40:56,"I can't really help much in finance or living situations, but I can upvote and comment to help get some views"
83,2017-01-01 16:56:59,"&gt;A Bachelor of Arts

At the U of W degrees in Economics are Bachelor of Arts and some degrees in Finance and Economics are Bachelor of Arts (others being BBA's)."
84,2017-01-01 21:29:29,"I've never seen or heard of this thing.

&gt;Australian Herald was established in September 2002 to provide up-to-the minute local news, together with national and international headlines as part of a global network pooling resources to deliver a quality service to member sites. Each online publication has been modeled on a newspaper format for familiar readability by users. 

&gt;The locations forming part of the network were selected on the basis of demand for news for that location.
Australian Herald, effectively an online newspaper, provides coverage of the city, the metro, and regional area. International news, business and finance stories are common across the network of sites, and are drawn from a number of sources including wire services.

&gt;Australian Herald and the other sites are administered by Midwest Radio Network from offices in Sydney, Australia."
85,2017-01-01 23:03:01,"The fact that you're already thinking about this stuff and have experience in the market means you're a decade ahead of where we were :) 

Not to downplay it, but it's not overly complicated. Lower your expenses, maximize your income, and passively invest using tax-advantaged vehicles first. Then stay the course.

The thing that we enjoy the absolute most about this whole process (besides the financial security, natch) is that it's forced us to DECIDE what we value, and allocate our money to reflect those values. We value financial freedom, but we also value travel, family, and season tickets to the Red Sox and Celtics :) 

Personal finance is personal. Decide what your values are, find a partner that shares them, then live your life!

"
